{
  "schema_version": "2.0",
  "card_id": "item-elbow-001",
  "card_version": 1,
  "lifecycle_status": "normalized",
  "item_type": "отвод",
  "subtype": "ОКШ",
  "name": "Отвод крутоизогнутый 90 градусов DN159",
  "designation": "ОКШ90-159x10-К48-09Г2С",
  "codes": {
    "mtr_code": "MTR-ELBOW-159-090",
    "ksm_code": "KSM-ELBOW-159-090"
  },
  "dcd": {
    "domain": {
      "code": "gas_pipeline",
      "name": "Газопровод"
    },
    "collection": {
      "code": "pipeline_fittings",
      "name": "Соединительные детали трубопровода"
    },
    "document": {
      "document_id": "passport-001",
      "document_type": "passport",
      "title": "Паспорт отвода ОКШ 90 DN159"
    }
  },
  "properties": {
    "dn": {
      "value": 159,
      "value_type": "number",
      "raw_value": "DN 159",
      "unit": "mm",
      "status": "normalized",
      "confidence": 0.99,
      "source_fragment_ids": [
        "fragment-elbow-main"
      ]
    },
    "angle": {
      "value": 90,
      "value_type": "number",
      "raw_value": "90°",
      "unit": "degree",
      "status": "normalized",
      "confidence": 0.99,
      "source_fragment_ids": [
        "fragment-elbow-main"
      ]
    },
    "wall_thickness": {
      "value": 10,
      "value_type": "number",
      "raw_value": "10 мм",
      "unit": "mm",
      "status": "normalized",
      "confidence": 0.98,
      "source_fragment_ids": [
        "fragment-elbow-main"
      ]
    },
    "pn": {
      "value": 160,
      "value_type": "number",
      "raw_value": "Ру 160",
      "unit": "bar",
      "status": "normalized",
      "confidence": 0.97,
      "source_fragment_ids": [
        "fragment-elbow-pressure"
      ]
    },
    "steel_grade": {
      "value": "09Г2С",
      "value_type": "string",
      "raw_value": "09Г2С",
      "unit": null,
      "status": "normalized",
      "confidence": 0.99,
      "source_fragment_ids": [
        "fragment-elbow-material"
      ]
    },
    "h2s_confirmed": {
      "value": true,
      "value_type": "boolean",
      "raw_value": "Допускается эксплуатация в среде H2S",
      "unit": null,
      "status": "expert_confirmed",
      "confidence": 1,
      "source_fragment_ids": [
        "fragment-elbow-medium"
      ]
    },
    "inner_coating": {
      "value": null,
      "value_type": "boolean",
      "raw_value": null,
      "unit": null,
      "status": "unknown",
      "confidence": null,
      "source_fragment_ids": []
    }
  },
  "sources": [
    {
      "source_id": "source-elbow-main",
      "type": "passport",
      "document_id": "passport-001",
      "file_name": "passport_001_oksh90_dn159.md",
      "source_fragment": {
        "fragment_id": "fragment-elbow-main",
        "text": "Отвод ОКШ 90°, DN 159, толщина стенки 10 мм.",
        "page": 1,
        "row": null,
        "bbox": null
      }
    },
    {
      "source_id": "source-elbow-pressure",
      "type": "passport",
      "document_id": "passport-001",
      "file_name": "passport_001_oksh90_dn159.md",
      "source_fragment": {
        "fragment_id": "fragment-elbow-pressure",
        "text": "Номинальное давление Ру 160.",
        "page": 1,
        "row": null,
        "bbox": null
      }
    },
    {
      "source_id": "source-elbow-material",
      "type": "passport",
      "document_id": "passport-001",
      "file_name": "passport_001_oksh90_dn159.md",
      "source_fragment": {
        "fragment_id": "fragment-elbow-material",
        "text": "Материал изделия: сталь 09Г2С.",
        "page": 1,
        "row": null,
        "bbox": null
      }
    },
    {
      "source_id": "source-elbow-medium",
      "type": "lnd",
      "document_id": "lnd-001",
      "file_name": "lnd_extract.md",
      "source_fragment": {
        "fragment_id": "fragment-elbow-medium",
        "text": "Допускается эксплуатация изделия в среде, содержащей H2S.",
        "page": 3,
        "row": null,
        "bbox": null
      }
    }
  ],
  "created_at": "2026-07-24T10:10:00+03:00",
  "updated_at": "2026-07-24T10:10:00+03:00"
}
